{
  "kind": "WorkspaceProjectReadback@1",
  "schema_version": 1,
  "workspace": {
    "root": "/work"
  },
  "scope": {
    "project_id": "alpha"
  },
  "project": {
    "project_id": "alpha",
    "name": "Alpha – café / core",
    "wrapper": "/work/alpha wrapper",
    "repo_count": 2
  },
  "repositories": [
    {
      "repo_id": "core",
      "locator": "/work/alpha wrapper/core",
      "git_common_dir": "/work/alpha wrapper/core/.git"
    },
    {
      "repo_id": "missing",
      "locator": "/work/missing checkout",
      "git_common_dir": "/work/registered common-dir/.git"
    }
  ]
}
